{
  "$schema": "../../schemas/material.schema.json",
  "id": "leather",
  "name": "Leather",
  "description": "Tanned and hardened hide (cuir bouilli for armor use). Modest resistance to piercing and slashing; flexible enough that blunt force still transfers well.",
  "category": "leather",
  "density_kg_m3": 860,
  "yield_strength": 0.20,
  "shear_strength": 0.10,
  "blunt_transfer": 0.65,
  "edge_retention": 0.65,
  "durability_mod": 0.8,
  "weight_mod":     0.7,
  "value_mod":      0.8
}
