{
  "$schema": "../../schemas/material.schema.json",
  "id": "wood",
  "name": "Wood",
  "description": "Dense hardwood (ash, oak). Low yield against blades but excellent mass-to-cost for bludgeoning heads.",
  "category": "wood",
  "density_kg_m3": 650,
  "yield_strength": 0.35,
  "shear_strength": 0.05,
  "blunt_transfer": 0.75,
  "edge_retention": 0.30,
  "durability_mod": 0.7,
  "weight_mod":     0.6,
  "value_mod":      0.2
}
