{
  "$schema": "../../schemas/material.schema.json",
  "id": "iron",
  "name": "Iron",
  "description": "Smelted wrought or cast iron. Strong but heavier than steel; slightly more brittle. Standard military metal.",
  "category": "metal",
  "density_kg_m3": 7874,
  "yield_strength": 1.00,
  "shear_strength": 0.35,
  "blunt_transfer": 0.45,
  "edge_retention": 0.90,
  "durability_mod": 1.0,
  "weight_mod":     1.0,
  "value_mod":      1.5
}
